{"execution_digest_sha256":"7e220841493f3914522d0c970ae9e7dd9997c4fb5f04491a58dafb84b39a141e","execution_vector":{"digest_sha256":"7e220841493f3914522d0c970ae9e7dd9997c4fb5f04491a58dafb84b39a141e","netuid":24,"network":"finney","omitted":[],"plan_digest_sha256":"bbbbbbbbbbbbbbbbbbbbbbbbbbbbbbbbbbbbbbbbbbbbbbbbbbbbbbbbbbbbbbbb","schema":"miss.computer/misscomputer-subnet/weight-execution-vector","schema_version":1,"validator_hotkey":"validator-hotkey","version_key":2,"weights":[{"hotkey":"miner-a-hotkey","planned_uid":9,"uid":9,"weight":1.0}]},"netuid":24,"network":"finney","plan_digest_sha256":"bbbbbbbbbbbbbbbbbbbbbbbbbbbbbbbbbbbbbbbbbbbbbbbbbbbbbbbbbbbbbbbb","request_id":"aaaaaaaaaaaaaaaaaaaaaaaaaaaaaaaaaaaaaaaaaaaaaaaaaaaaaaaaaaaaaaaa","schema":"miss.computer/misscomputer-subnet/weight-signer-request","schema_version":2,"validator_hotkey":"validator-hotkey"}
